<?xml version="1.0" encoding="iso-8859-1"?>
<!DOCTYPE tags SYSTEM "tag.dtd">
<tags>
  <mesh id="1" name="Test">
    <v x="0.0" y="1.0" z="0.0" u="1" v="0" />
    <v x="-1.0" y="-1.5" z="0.0" u="1" v="0" />
    <v x="0.0" y="-1.0" z="0.5" u="1" v="0" />
    <v x="1.0" y="-1.5" z="0.0" u="1" v="0" />
    <v x="0.0" y="-1.5" z="1.0" u="1" v="0" />
    <t v1="0" v2="1" v3="2" />
    <t v1="2" v2="1" v3="0" />
    <t v1="0" v2="2" v3="3" />
    <t v1="3" v2="2" v3="0" />
    <t v1="0" v2="2" v3="4" />
    <t v1="4" v2="2" v3="0" />
    </mesh>
    <mesh id="2" name="Cockpit">
        <v x="-1" y="0" z="1" u="0" v="0" />
        <v x="-.8" y="0" z="1" u="1" v="0" />
        <v x=".8" y="0" z="1" u="0" v="0" />
        <v x="1" y="0" z="1" u="1" v="0" />
        <v x="-.8" y="1" z="-.4" u="1" v="0" />
        <v x="-.6" y="1" z="-.4" u="1" v="0" />
        <v x=".6" y="1" z="-.4" u="1" v="0" />
        <v x=".8" y="1" z="-.4" u="1" v="0" />
        <v x="-1" y="0" z="-1" u="1" v="0" />
        <v x="1" y="0" z="-1" u="1" v="1" />
        <t v1="1" v2="0" v3="5" />
        <t v1="4" v2="5" v3="0" />
        <t v1="3" v2="2" v3="6" />
        <t v1="3" v2="6" v3="7" />
        <t v1="4" v2="8" v3="9" />
        <t v1="4" v2="9" v3="7" />
    </mesh>
</tags>
