<?xml version="1.0" encoding="UTF-8"?>
<!DOCTYPE tags SYSTEM "tag.dtd">
<tags>
    <sun id="0" name="The Sun">
        <mass>100000000.0</mass>
        <radius>1000</radius>
        <rotation>.25</rotation>
        <textureLink id="4"/>
        <pointLight>
            <ambientLight red="1.0" green="1.0" blue="1.0" alpha="1.0" />
            <diffuseLight red="1.0" green="1.0" blue="1.0" alpha="1.0" />
            <specularLight red="1.0" green="1.0" blue="1.0" alpha="1.0" />
            <location x="0" y="0" z="0" />
        </pointLight>
        <material>
            <ambientLight red="0.0" green="0.0" blue="0.0" alpha="1.0" />
            <diffuseLight red="0.0" green="0.0" blue="0.0" alpha="1.0" />
            <specularLight red="0.0" green="0.0" blue="0.0" alpha="1.0" />
            <emissionLight red="1.0" green="1.0" blue="1.0" alpha="1.0" />
            <shininess>0</shininess>
        </material>
    </sun>
    <sun id="1" name="The Sun">
        <mass>1000000.0</mass>
        <radius>200</radius>
        <rotation>.25</rotation>
        <textureLink id="4"/>
        <pointLight>
            <ambientLight red="0.3" green="0.3" blue="0.3" alpha="1.0" />
            <diffuseLight red="1.0" green="1.0" blue="1.0" alpha="1.0" />
            <specularLight red="1.0" green="1.0" blue="1.0" alpha="1.0" />
            <location x="0" y="0" z="0" />
        </pointLight>
        <material>
            <ambientLight red="0.0" green="0.0" blue="0.0" alpha="1.0" />
            <diffuseLight red="0.0" green="0.0" blue="0.0" alpha="1.0" />
            <specularLight red="0.0" green="0.0" blue="0.0" alpha="1.0" />
            <emissionLight red="1.0" green="1.0" blue="1.0" alpha="1.0" />
            <shininess>0</shininess>
        </material>
    </sun>
</tags>
